{
  "schema": "qalab.run/1",
  "run_id": "20261005T103000Z-s42",
  "project": "QALabSandbox",
  "qalab_version": "0.1.0",
  "build": {
    "version": "0.1.0",
    "platform": "StandaloneWindows64",
    "unity": "6000.0.0f1",
    "git_sha": "0000000",
    "development": true
  },
  "mode": "player",
  "adapter": "navmesh_explorer",
  "seed": 42,
  "scenes": [
    "Sandbox_Level01"
  ],
  "duration_s": 55,
  "started_at": "2026-10-05T10:30:00.000Z",
  "ended_at": "2026-10-05T10:30:55.100Z",
  "exit_reason": "duration_elapsed",
  "exit_code": 1,
  "machine": {
    "os": "Windows 11",
    "cpu": "example CPU",
    "gpu": "example GPU",
    "ram_gb": 16
  },
  "benchmark": true,
  "seeds_enabled": [
    "SB01",
    "SB02",
    "SB03",
    "SB04",
    "SB06",
    "SB08",
    "SB09",
    "SB10",
    "SB13",
    "SB14"
  ]
}
